<!ELEMENT bookstore (book+)>
<!ELEMENT book (title, author, genre, price, year, stock)>
<!ELEMENT title (#PCDATA)>
<!ELEMENT author (#PCDATA)>
<!ELEMENT genre (#PCDATA)>
<!ELEMENT price (#PCDATA)>
<!ELEMENT year (#PCDATA)>
<!ELEMENT stock (#PCDATA)>